<?xml version="1.0" encoding="UTF-8"?>
<root xmlns="a"
	xmlns:xsi="http://www.w3.org/2001/XMLSchema-instance"
	xsi:schemaLocation="a schema.xsd"
>
	<child>123</child>
	<list>1</list>
	<list>2</list>
	<reg>123</reg>
	<date>2019-01-01</date>
	<number>123</number>
	<decimal>123.123</decimal>
</root>